{
  "id": "context_pack.task_implement_retry_policy",
  "task_id": "task.implement_retry_policy",
  "source_graph": "package.notification_api_spec_pilot_002",
  "generated_at": "2026-05-28T19:46:09.425Z",
  "included_objects": [
    "source.notification_api_brief",
    "requirement.notify_after_event",
    "feature.webhook_delivery",
    "feature.retry_policy",
    "component.delivery_worker",
    "constraint.no_secret_logging",
    "risk.duplicate_delivery",
    "risk.credential_leak",
    "decision.idempotency_key_required",
    "task.implement_retry_policy"
  ],
  "included_relations": [
    "relation.feature.webhook_delivery.implements.requirement.notify_after_event",
    "relation.feature.retry_policy.depends_on.feature.webhook_delivery",
    "relation.component.delivery_worker.implements.feature.retry_policy",
    "relation.constraint.no_secret_logging.blocks.risk.credential_leak",
    "relation.feature.retry_policy.related_to.risk.duplicate_delivery",
    "relation.decision.idempotency_key_required.blocks.risk.duplicate_delivery",
    "relation.task.implement_retry_policy.implements.feature.retry_policy",
    "relation.task.implement_retry_policy.depends_on.requirement.notify_after_event",
    "relation.task.implement_retry_policy.depends_on.decision.idempotency_key_required"
  ],
  "evidence": [
    "source.notification_api_brief"
  ],
  "selection": {
    "method": "token_matching_one_hop_relation_expansion_safety_shared_evidence",
    "task_tokens": [
      "task",
      "implement",
      "retry",
      "policy"
    ],
    "object_explanations": [
      {
        "id": "source.notification_api_brief",
        "relevance_score": -1,
        "reasons": [
          "evidence referenced by selected object"
        ]
      },
      {
        "id": "requirement.notify_after_event",
        "relevance_score": 0,
        "reasons": [
          "one-hop relation expansion from relation.task.implement_retry_policy.depends_on.requirement.notify_after_event"
        ]
      },
      {
        "id": "feature.webhook_delivery",
        "relevance_score": 0,
        "reasons": [
          "one-hop relation expansion from relation.feature.retry_policy.depends_on.feature.webhook_delivery"
        ]
      },
      {
        "id": "feature.retry_policy",
        "relevance_score": 6,
        "reasons": [
          "exact token match: retry",
          "exact token match: policy"
        ]
      },
      {
        "id": "component.delivery_worker",
        "relevance_score": 0,
        "reasons": [
          "one-hop relation expansion from relation.component.delivery_worker.implements.feature.retry_policy"
        ]
      },
      {
        "id": "constraint.no_secret_logging",
        "relevance_score": 0,
        "reasons": [
          "safety-sensitive object with shared evidence"
        ]
      },
      {
        "id": "risk.duplicate_delivery",
        "relevance_score": 0,
        "reasons": [
          "one-hop relation expansion from relation.feature.retry_policy.related_to.risk.duplicate_delivery"
        ]
      },
      {
        "id": "risk.credential_leak",
        "relevance_score": 0,
        "reasons": [
          "safety-sensitive object with shared evidence"
        ]
      },
      {
        "id": "decision.idempotency_key_required",
        "relevance_score": 0,
        "reasons": [
          "one-hop relation expansion from relation.task.implement_retry_policy.depends_on.decision.idempotency_key_required"
        ]
      },
      {
        "id": "task.implement_retry_policy",
        "relevance_score": 12,
        "reasons": [
          "exact token match: task",
          "exact token match: implement",
          "exact token match: retry",
          "exact token match: policy"
        ]
      }
    ],
    "relation_explanations": [
      {
        "id": "relation.feature.webhook_delivery.implements.requirement.notify_after_event",
        "reason": "connects selected objects after safety/evidence expansion",
        "source": "feature.webhook_delivery",
        "target": "requirement.notify_after_event"
      },
      {
        "id": "relation.feature.retry_policy.depends_on.feature.webhook_delivery",
        "reason": "one-hop relation expansion from direct object match",
        "source": "feature.retry_policy",
        "target": "feature.webhook_delivery"
      },
      {
        "id": "relation.component.delivery_worker.implements.feature.retry_policy",
        "reason": "one-hop relation expansion from direct object match",
        "source": "component.delivery_worker",
        "target": "feature.retry_policy"
      },
      {
        "id": "relation.constraint.no_secret_logging.blocks.risk.credential_leak",
        "reason": "connects selected objects after safety/evidence expansion",
        "source": "constraint.no_secret_logging",
        "target": "risk.credential_leak"
      },
      {
        "id": "relation.feature.retry_policy.related_to.risk.duplicate_delivery",
        "reason": "one-hop relation expansion from direct object match",
        "source": "feature.retry_policy",
        "target": "risk.duplicate_delivery"
      },
      {
        "id": "relation.decision.idempotency_key_required.blocks.risk.duplicate_delivery",
        "reason": "connects selected objects after safety/evidence expansion",
        "source": "decision.idempotency_key_required",
        "target": "risk.duplicate_delivery"
      },
      {
        "id": "relation.task.implement_retry_policy.implements.feature.retry_policy",
        "reason": "one-hop relation expansion from direct object match",
        "source": "task.implement_retry_policy",
        "target": "feature.retry_policy"
      },
      {
        "id": "relation.task.implement_retry_policy.depends_on.requirement.notify_after_event",
        "reason": "one-hop relation expansion from direct object match",
        "source": "task.implement_retry_policy",
        "target": "requirement.notify_after_event"
      },
      {
        "id": "relation.task.implement_retry_policy.depends_on.decision.idempotency_key_required",
        "reason": "one-hop relation expansion from direct object match",
        "source": "task.implement_retry_policy",
        "target": "decision.idempotency_key_required"
      }
    ]
  },
  "assumptions": [
    "Alpha generator uses token matching plus one-hop relation expansion.",
    "Safety-sensitive constraints and risks with shared evidence are included."
  ],
  "omissions": [
    "package.team_notification_api"
  ],
  "limitations": [
    "Generated context pack is not canonical state.",
    "This alpha generator does not prove semantic completeness."
  ]
}
